{
  "capture_method": "python-importlib.metadata-name-version-only",
  "captured_at_utc": "2026-07-19T08:43:41Z",
  "excluded_metadata": [
    "absolute paths",
    "direct URLs",
    "download locations",
    "installer configuration",
    "credentials",
    "host and user identity"
  ],
  "inventory_id": "dependency-inventory-20260719-attempt-002",
  "package_count": 193,
  "packages": [
    {
      "name": "aiohappyeyeballs",
      "version": "2.6.2"
    },
    {
      "name": "aiohttp",
      "version": "3.14.1"
    },
    {
      "name": "aiosignal",
      "version": "1.4.0"
    },
    {
      "name": "annotated-doc",
      "version": "0.0.4"
    },
    {
      "name": "annotated-types",
      "version": "0.7.0"
    },
    {
      "name": "anthropic",
      "version": "0.109.1"
    },
    {
      "name": "anyio",
      "version": "4.13.0"
    },
    {
      "name": "apache-tvm-ffi",
      "version": "0.1.9"
    },
    {
      "name": "astor",
      "version": "0.8.1"
    },
    {
      "name": "attrs",
      "version": "26.1.0"
    },
    {
      "name": "blake3",
      "version": "1.0.8"
    },
    {
      "name": "cachetools",
      "version": "7.1.4"
    },
    {
      "name": "cbor2",
      "version": "6.1.2"
    },
    {
      "name": "certifi",
      "version": "2026.5.20"
    },
    {
      "name": "cffi",
      "version": "2.0.0"
    },
    {
      "name": "charset-normalizer",
      "version": "3.4.7"
    },
    {
      "name": "click",
      "version": "8.4.1"
    },
    {
      "name": "cloudpickle",
      "version": "3.1.2"
    },
    {
      "name": "compressed-tensors",
      "version": "0.17.0"
    },
    {
      "name": "cryptography",
      "version": "48.0.1"
    },
    {
      "name": "cuda-bindings",
      "version": "13.3.1"
    },
    {
      "name": "cuda-core",
      "version": "1.0.1"
    },
    {
      "name": "cuda-pathfinder",
      "version": "1.5.5"
    },
    {
      "name": "cuda-python",
      "version": "13.3.1"
    },
    {
      "name": "cuda-tile",
      "version": "1.3.0"
    },
    {
      "name": "cuda-toolkit",
      "version": "13.0.2"
    },
    {
      "name": "depyf",
      "version": "0.20.0"
    },
    {
      "name": "detect-installer",
      "version": "0.1.0"
    },
    {
      "name": "dill",
      "version": "0.4.1"
    },
    {
      "name": "diskcache",
      "version": "5.6.3"
    },
    {
      "name": "distro",
      "version": "1.9.0"
    },
    {
      "name": "dnspython",
      "version": "2.8.0"
    },
    {
      "name": "docstring-parser",
      "version": "0.18.0"
    },
    {
      "name": "einops",
      "version": "0.8.2"
    },
    {
      "name": "email-validator",
      "version": "2.3.0"
    },
    {
      "name": "fastapi",
      "version": "0.136.3"
    },
    {
      "name": "fastapi-cli",
      "version": "0.0.24"
    },
    {
      "name": "fastapi-cloud-cli",
      "version": "0.19.0"
    },
    {
      "name": "fastar",
      "version": "0.11.0"
    },
    {
      "name": "fastsafetensors",
      "version": "0.3.2"
    },
    {
      "name": "filelock",
      "version": "3.29.3"
    },
    {
      "name": "flashinfer-cubin",
      "version": "0.6.12"
    },
    {
      "name": "flashinfer-python",
      "version": "0.6.12"
    },
    {
      "name": "frozenlist",
      "version": "1.8.0"
    },
    {
      "name": "fsspec",
      "version": "2026.4.0"
    },
    {
      "name": "gguf",
      "version": "0.19.0"
    },
    {
      "name": "googleapis-common-protos",
      "version": "1.75.0"
    },
    {
      "name": "grpcio",
      "version": "1.81.0"
    },
    {
      "name": "h11",
      "version": "0.16.0"
    },
    {
      "name": "hf-xet",
      "version": "1.5.1"
    },
    {
      "name": "httpcore",
      "version": "1.0.9"
    },
    {
      "name": "httptools",
      "version": "0.8.0"
    },
    {
      "name": "httpx",
      "version": "0.28.1"
    },
    {
      "name": "httpx-sse",
      "version": "0.4.3"
    },
    {
      "name": "huggingface-hub",
      "version": "1.18.0"
    },
    {
      "name": "humming-kernels",
      "version": "0.1.4"
    },
    {
      "name": "idna",
      "version": "3.18"
    },
    {
      "name": "ijson",
      "version": "3.5.0"
    },
    {
      "name": "interegular",
      "version": "0.3.3"
    },
    {
      "name": "jinja2",
      "version": "3.1.6"
    },
    {
      "name": "jiter",
      "version": "0.15.0"
    },
    {
      "name": "jmespath",
      "version": "1.1.0"
    },
    {
      "name": "jsonschema",
      "version": "4.26.0"
    },
    {
      "name": "jsonschema-specifications",
      "version": "2025.9.1"
    },
    {
      "name": "lark",
      "version": "1.2.2"
    },
    {
      "name": "llguidance",
      "version": "1.7.6"
    },
    {
      "name": "llvmlite",
      "version": "0.47.0"
    },
    {
      "name": "lm-format-enforcer",
      "version": "0.11.3"
    },
    {
      "name": "loguru",
      "version": "0.7.3"
    },
    {
      "name": "markdown-it-py",
      "version": "4.2.0"
    },
    {
      "name": "markupsafe",
      "version": "3.0.3"
    },
    {
      "name": "mcp",
      "version": "1.27.2"
    },
    {
      "name": "mdurl",
      "version": "0.1.2"
    },
    {
      "name": "mistral-common",
      "version": "1.11.3"
    },
    {
      "name": "ml-dtypes",
      "version": "0.5.4"
    },
    {
      "name": "model-hosting-container-standards",
      "version": "0.1.15"
    },
    {
      "name": "mpmath",
      "version": "1.3.0"
    },
    {
      "name": "msgspec",
      "version": "0.21.1"
    },
    {
      "name": "multidict",
      "version": "6.7.1"
    },
    {
      "name": "networkx",
      "version": "3.6.1"
    },
    {
      "name": "ninja",
      "version": "1.13.0"
    },
    {
      "name": "numba",
      "version": "0.65.0"
    },
    {
      "name": "numpy",
      "version": "2.3.5"
    },
    {
      "name": "nvidia-cublas",
      "version": "13.1.0.3"
    },
    {
      "name": "nvidia-cuda-cccl",
      "version": "13.3.3.3.1"
    },
    {
      "name": "nvidia-cuda-crt",
      "version": "13.3.33"
    },
    {
      "name": "nvidia-cuda-cupti",
      "version": "13.0.85"
    },
    {
      "name": "nvidia-cuda-nvcc",
      "version": "13.2.78"
    },
    {
      "name": "nvidia-cuda-nvrtc",
      "version": "13.0.88"
    },
    {
      "name": "nvidia-cuda-runtime",
      "version": "13.0.96"
    },
    {
      "name": "nvidia-cuda-tileiras",
      "version": "13.2.78"
    },
    {
      "name": "nvidia-cudnn-cu13",
      "version": "9.19.0.56"
    },
    {
      "name": "nvidia-cudnn-frontend",
      "version": "1.25.0"
    },
    {
      "name": "nvidia-cufft",
      "version": "12.0.0.61"
    },
    {
      "name": "nvidia-cufile",
      "version": "1.15.1.6"
    },
    {
      "name": "nvidia-curand",
      "version": "10.4.0.35"
    },
    {
      "name": "nvidia-cusolver",
      "version": "12.0.4.66"
    },
    {
      "name": "nvidia-cusparse",
      "version": "12.6.3.3"
    },
    {
      "name": "nvidia-cusparselt-cu13",
      "version": "0.8.0"
    },
    {
      "name": "nvidia-cutlass-dsl",
      "version": "4.5.2"
    },
    {
      "name": "nvidia-cutlass-dsl-libs-base",
      "version": "4.5.2"
    },
    {
      "name": "nvidia-cutlass-dsl-libs-cu13",
      "version": "4.5.2"
    },
    {
      "name": "nvidia-ml-py",
      "version": "13.610.43"
    },
    {
      "name": "nvidia-nccl-cu13",
      "version": "2.28.9"
    },
    {
      "name": "nvidia-nvjitlink",
      "version": "13.0.88"
    },
    {
      "name": "nvidia-nvshmem-cu13",
      "version": "3.4.5"
    },
    {
      "name": "nvidia-nvtx",
      "version": "13.0.85"
    },
    {
      "name": "nvidia-nvvm",
      "version": "13.2.78"
    },
    {
      "name": "openai",
      "version": "2.41.1"
    },
    {
      "name": "openai-harmony",
      "version": "0.0.8"
    },
    {
      "name": "opencv-python-headless",
      "version": "4.13.0.92"
    },
    {
      "name": "opentelemetry-api",
      "version": "1.42.1"
    },
    {
      "name": "opentelemetry-exporter-otlp",
      "version": "1.42.1"
    },
    {
      "name": "opentelemetry-exporter-otlp-proto-common",
      "version": "1.42.1"
    },
    {
      "name": "opentelemetry-exporter-otlp-proto-grpc",
      "version": "1.42.1"
    },
    {
      "name": "opentelemetry-exporter-otlp-proto-http",
      "version": "1.42.1"
    },
    {
      "name": "opentelemetry-proto",
      "version": "1.42.1"
    },
    {
      "name": "opentelemetry-sdk",
      "version": "1.42.1"
    },
    {
      "name": "opentelemetry-semantic-conventions",
      "version": "0.63b1"
    },
    {
      "name": "opentelemetry-semantic-conventions-ai",
      "version": "0.5.1"
    },
    {
      "name": "outlines-core",
      "version": "0.2.14"
    },
    {
      "name": "packaging",
      "version": "26.2"
    },
    {
      "name": "partial-json-parser",
      "version": "0.2.1.1.post7"
    },
    {
      "name": "pillow",
      "version": "12.2.0"
    },
    {
      "name": "pip",
      "version": "26.1.2"
    },
    {
      "name": "prometheus-client",
      "version": "0.25.0"
    },
    {
      "name": "prometheus-fastapi-instrumentator",
      "version": "8.0.0"
    },
    {
      "name": "propcache",
      "version": "0.5.2"
    },
    {
      "name": "protobuf",
      "version": "6.33.6"
    },
    {
      "name": "psutil",
      "version": "7.2.2"
    },
    {
      "name": "py-cpuinfo",
      "version": "9.0.0"
    },
    {
      "name": "pybase64",
      "version": "1.4.3"
    },
    {
      "name": "pycountry",
      "version": "26.2.16"
    },
    {
      "name": "pycparser",
      "version": "3.0"
    },
    {
      "name": "pydantic",
      "version": "2.13.4"
    },
    {
      "name": "pydantic-core",
      "version": "2.46.4"
    },
    {
      "name": "pydantic-extra-types",
      "version": "2.11.1"
    },
    {
      "name": "pydantic-settings",